{
  "implementation_profile_id": "triton_cuda",
  "implementation_profile_sha256": "0000000000000000000000000000000000000000000000000000000000000000",
  "implementation_profile_version": 1,
  "primary_contract": "matrix.dot",
  "primary_signature": {
    "dtype": "fp32"
  },
  "qualification_dispositions": [],
  "runtime_fingerprint": "triton 3.6.0",
  "schema_version": 1,
  "target_id": "mlu590"
}
